{
  "id": "test-team-1-backend-1",
  "role": "backend",
  "version": "1.0.0",
  "name": "backend Bot",
  "description": "backend specialist",
  "model": "openrouter/anthropic/claude-3.5-sonnet",
  "capabilities": [
    "github-cli",
    "npm-scripts",
    "database-migrate",
    "stripe-cli",
    "docker-compose"
  ],
  "allowedDomains": [
    "backend",
    "devops"
  ],
  "reportTemplate": "execution-report-v1",
  "learning": {
    "enabled": false,
    "mode": "report-only"
  },
  "resourceLimits": {
    "maxDurationMs": 1800000,
    "maxTokens": 100000,
    "maxToolCalls": 50
  },
  "metadata": {
    "createdBy": "severino-factory",
    "createdAt": "2026-10-10T18:33:18.427Z",
    "skillKits": [
      "01-engenharia/backend-dev-kit"
    ],
    "primaryLanguage": "typescript",
    "framework": "fastify"
  }
}