{
  "id": "robot-final-test-qa-2",
  "role": "qa",
  "version": "1.0.0",
  "name": "Final Test Team qa",
  "description": "qa specialist",
  "model": "openrouter/anthropic/claude-3.5-sonnet",
  "capabilities": [
    "playwright",
    "vitest",
    "k6",
    "github-cli",
    "npm-scripts"
  ],
  "allowedDomains": [
    "qa",
    "backend",
    "frontend"
  ],
  "reportTemplate": "execution-report-v1",
  "learning": {
    "enabled": false,
    "mode": "report-only"
  },
  "resourceLimits": {
    "maxDurationMs": 1800000,
    "maxTokens": 100000,
    "maxToolCalls": 50
  },
  "metadata": {
    "createdBy": "severino-factory",
    "createdAt": "2026-10-10T18:41:58.002Z",
    "skillKits": [
      "01-engenharia/qa-engineer-kit"
    ],
    "primaryLanguage": "typescript",
    "framework": "vitest+playwright"
  }
}